Colonia,NoAsignacion,Descripcion,MontoContratado,EmpresaContratista,ClaseAsigna,ZonaC,Rubro,SubRubro,FechaInicio,FechaTermino,StatusAdmvo,Control,Anio396,001/P-AD-C01-07,CONSTRUCCIoN DE BOCA DE TORMENTA TIPO TRANSVERSAL Y LiNEA DE ALEJAMIENTO UBICADA EN AVENIDA JUAN GIL PRECIADO ESQUINA CON CALLE COPALITA EN LA COLONIA VICENTE GUERRERO.,220000,CONSTRUCCIONES ELECTRIFICACIONES Y ARRENDAMIENTOS DE MAQUINARIA S.A. DE C.V.,Obra,3,Infraestructura Urbana,Alcantarillado,26-Mar-07,26-Abr-07,Finiquitada,1,2007144,004/P-AD-C01-07,SUMINISTRO Y APLICACIoN DE SELLO SLURRY SEAL UBICADO EN LA CALLE ALHELIES ENTRE SANTA MARGARITA Y SANTA ESTHER EN  COLONIA GIRASOLES,150000,CONSTRU-OPCION S.A. DE C.V.,Obra,4,Infraestructura Urbana,Infraestructura Vial,30-Abr-07,30-May-07,Finiquitada,1,2007167,006/P-AD-C01-07,AMPLIACION DE CARRILES UBICADO ENTRE LA CUMBRE Y EL POBLADO DE HUAXTLA A PARTIR DEL CADENAMIENTO 0+111.38 2DA. ETAPA,246949.68,P Y P CONSTRUCTORA S.A. DE C.V.,Obra,RN,Infraestructura Urbana,Infraestructura Rural,21-May-07,21-Jun-07,Finiquitada,1,200723,007/P-AD-C01-07,CONSTRUCCION DE CARPETA  ASFALTICA Y SELLO SLURRY SEAL SOBRE EMPEDRADO UBICADO EN LA CALLE FCO. I. MADERO ENTRE LA CARRETERA A SALTILLO Y CALLE PIPILA EN LA COL. ARROYO HONDO.,254816.38,CONSTRUCCIONES ELECTRIFICACIONES Y ARRENDAMIENTOS DE MAQUINARIA S.A. DE C.V.,Obra,2A,Infraestructura Urbana,Infraestructura Vial,26-Mar-07,26-Abr-07,Finiquitada,1,200725,009/P-AD-C01-07,REMODELACION DE PLAZA CIVICA EN LAS CALLES ALDAMA Y NIniOS HEROES EN LA COLONIA ATEMAJAC DEL VALLE.,250000,CONSTRUCTUR S.A DE C.V.,Obra,1B,Equipamiento Urbano,Cultura,12-Jun-07,12-Jul-07,Finiquitada,1,200737,016/P-ES-C01-07,PRIMERA ETAPA PARA LA CONSTRUCCION DE URBANIZACION E INFRAESTRUCTURA PARA LOS SERVICIOS DE AGUA POTABLE ALCANTARILLADO ELECTRIFICACION Y PAVIMENTOS DE LA UNIDAD HABITACIONAL BELENES UBICADA EN AV. VENUSTIANO CARRANZA ESQUINA CON AVENIDA ENRIQUE DIAZ DE,507170.85,BREYSA CONSTRUCTORA S.A. DE C.V.,Escalatoria,1B,Infraestructura Urbana,Otros,,,Finiquitada,1,2007237,017/P-CR-C01-07,CONSTRUCCION DE CARRILES CENTRALES EN LA AV. PROLONGACION MARIANO OTERO INICIANDO EN EL CRUCE CON LA CALLE JAVIER MINA CADENAMIENTO 1+177 AL CADENAMIENTO 1+570 EN LA COL. MARIANO OTERO,5292886.33,ALFRA INGENIEROS S.A. DE C.V.,Obra,7,Infraestructura Urbana,Infraestructura Vial,31-Mar-07,15-Oct-07,Terminada sin Finiquitar,1,200725,018/P-AD-C01-07,TRAZO NIVELACION Y CONFORMACION DE TERRACERIA PARA OBRA DE ADOQUIN EN LA CALLE REFORMA ENTRE LA PRIVADA REFORMA Y EJIDO CALLE HILARIO T. ROCHA ENTRE CALLE REFORMA Y CERRADA CALLE LOPEZ MATEOS ENTRE HILARIO T. ROCHA Y EJIDO CALLE EJIDO ENTRE REFORMA Y,503076.38,ING. JOSE LUIS FRAUSTO MIRANDA,Obra,1B,Infraestructura Urbana,Infraestructura Vial,18-Abr-07,2-Jun-07,Finiquitada,1,200725,019/P-AD-C01-07,TRAZO NIVELACION Y CONFORMACION DE TERRACERIA PARA OBRA DE ADOQUIN EN LA CALLE REFORMA ENTRE AV. EXPERIENCIA Y PRIV. REFORMA CALLE LOPEZ MATEOS ENTRE EXPERIENCIA E HILARIO T. ROCHA CALLE AQUILES SERDAN ENTRE REFORMA Y LOPEZ MATEOS CALLE JUAN ANTONIO,771275.35,BREYSA CONSTRUCTORA S.A. DE C.V.,Obra,1B,Infraestructura Urbana,Infraestructura Vial,21-May-07,5-Jul-07,Finiquitada,1,2007408,020/P-AD-C01-07,TRAZO NIVELACIoN Y CONFORMACIoN DE TERRACERIAS PARA EMPEDRADO EN LA CALLE IGNACIO ESPINOZA DE SANTOS RIVERA A IRINEO OSORIO EN LA COLONIA VILLAS DE GUADALUPE COMITe No. 273,348544.32,ACONT S.A. DE C.V.,Obra,2B,Infraestructura Urbana,Infraestructura Vial,30-Abr-07,30-May-07,Finiquitada,1,200732,022/P-AD-C01-07,TRAZO NIVELACIoN Y CONFORMACIoN DE TERRACERIA DE LA CALLE DIAMANTE DESDE LOMA BONITA HASTA EL CANAL Y CALLE PRIV. DIAMANTE DESDE DIAMANTE HASTA EL ARROYO COLONIA BALCONES DE LA CANTERA COMITe No. 144,283250.08,VECTOR GRUPO CONSTRUCTOR S.A. DE C.V.,Obra,2A,Infraestructura Urbana,Infraestructura Vial,12-Abr-07,12-Jun-07,Finiquitada,1,2007349,023/P-AD-C01-07,TRAZO NIVELACION Y CONFORMACION DE TERRACERIA PARA OBRA DE ADOQUIN EN LA CALLE PRIV. LIBERTAD ENTRE LA CALLE LIBERTAD Y CERRADA EN LA COLONIA SAN JUAN DE OCOTAN COMITe NO. 44-A,187313.59,TORRES AGUIRRE INGENIEROS S.A. DE C.V.,Obra,4,Infraestructura Urbana,Infraestructura Vial,4-Jun-07,4-Jul-07,Finiquitada,1,2007349,024/P-AD-C01-07,TRAZO NIVELACION Y CONFORMACION DE TERRACERIA PARA OBRA DE EMPEDRADO EN LA CALLE PRIV. DEL SOL  ENTRE LA CALLE PARRAL Y LA CERRADA EN LA COLONIA SAN JUAN DE OCOTAN COMITe NO. 225,381947.09,TORRES AGUIRRE INGENIEROS S.A. DE C.V.,Obra,4,Infraestructura Urbana,Infraestructura Vial,4-Jun-07,4-Jul-07,Finiquitada,1,200783,025/P-AD-C01-07,TRAZO NIVELACIoN Y CONFORMACIoN DE TERRACERIA DE LA CALLE TABACHINES DE NOCHE BUENA A VOLCaN EN LA COLONIA COLINAS DE LA PRIMAVERA COMITe No. 164 PEC,133195.2,VECTOR GRUPO CONSTRUCTOR S.A. DE C.V.,Obra,7,Infraestructura Urbana,Infraestructura Vial,30-Abr-07,30-May-07,Finiquitada,1,200755,027/P-AD-C01-07,TRAZO NIVELACIoN Y CONFORMACIoN DE TERRACERIA DE LA CALLE SAN JOSe DE LA CALLE SANTA LUCIA A LA CALLE SAN RAFAEL EN LA COLONIA EL CAMPANARIO DEL COMITe No. 310,196440.47,ALFRA INGENIEROS S.A. DE C.V.,Obra,8,Infraestructura Urbana,Infraestructura Vial,14-Jun-07,14-Jul-07,Finiquitada,1,2007360,028/P-AD-C01-07,TRAZO NIVELACIoN Y CONFORMACIoN DE TERRACERIA PARA EMPEDRADO EN LA PRIVADA LoPEZ MATEOS DE CALLE 5 DE MAYO A CERRADA EN LA COLONIA SANTA LUCIA  COMITe NO. 288,143480.52,GRANDE DE MEXICO CONSTRUCTORA E INMOBILIARIA S.A. DE C.V.,Obra,RS,Infraestructura Urbana,Infraestructura Vial,12-Mar-07,12-Abr-07,Finiquitada,1,20077,031/P-CP-C01-07,CONSTRUCCION DE COLECTOR PLUVIAL POR CALLE VICENTE GUERRERO LAZARO CARDENAS FRANCISCO VILLA Y JOSEFA ORTIZ DE DOMINGUEZ ENTRE AV. LOPEZ MATEOS Y CANAL EN LA COLONIA AGUA BLANCA,10100564.46,ESTRUCTURAS CONSTRUCCIONES Y URBANIZACIONES S.A. DE C.V.,Obra,8,Infraestructura Urbana,Colectores,3-May-07,15-Oct-07,Finiquitada,1,200785,035/P-CA-C02-07,ELABORACION DE PROYECTO PARA LA CONSTRUCCION DE TEATRO AL AIRE LIBRE UBICADO EN LA CONFLUENCIA DE LAS CALLES PINOS Y CEDROS EN LA COLONIA COLINAS DE LOS ROBLES.,27187.5,ARQ. FERNANDO DANIEL TORRES MANCILLA,Convenio Adicional,3,Equipamiento Urbano,Cultura,23-Abr-07,7-May-07,Finiquitada,1,2007222,036/P-OT-C02-07,DESARROLLO DE 16 ESTUDIOS DE MECANICA DE SUELOS PARA LOS SIGUIENTES COMITES DEL PROGRAMA DE ESFUERZOS COMPARTIDOS: COMITe Nº.72 157 267 Y 345 DE LA COL. PARAISOS DEL COLLI COMITe Nº. 190 DE LA COL. BALCONES DEL SOL COMITe Nº. 163 DE LA COL. COLINAS DE,82800,ING. EDUARDO ALONSO LOPEZ FLORES,Estudio y/o Proyecto,1B,Infraestructura Urbana,Otros,16-Abr-07,16-May-07,Finiquitada,1,200734,037/P-OT-C02-07,ELABORACION DE PROYECTOS PARA EL TRAZO NIVELACION Y CONFORMACION DE TERRACERIAS PARA LOS SIGUIENTES COMITES DE OBRA DEL PROGRAMA DE ESFUERZOS COMPARTIDOS: COMITe Nº.157 267 Y 345 DE LA COL. PARAISOS DEL COLLI Y COMITe Nº. 190 DE LA COL. BALCONES DEL SOL,62600,GRUPO CONSTRUCTOR COUNTRY S.A. DE C.V.,Estudio y/o Proyecto,7,Infraestructura Urbana,Infraestructura Vial,4-Jun-07,18-Jun-07,Finiquitada,1,2007129,038/P-OT-C02-07,ELABORACION DE PROYECTOS PARA EL TRAZO NIVELACION Y CONFORMACION DE TERRACERIAS PARA LOS SIGUIENTES COMITES DE OBRA DEL PROGRAMA DE ESFUERZOS COMPARTIDOS: COMITe Nº. 163 DE LA COL. COLINAS DE LA PRIMAVERA COMITe Nº. 254 DE LA COL. LOS CAJETES COMITE N.,112500,STELLA CONSTRUCCIONES S.A.. DE C.V.,Estudio y/o Proyecto,7,Infraestructura Urbana,Infraestructura Vial,4-Jun-07,18-Jul-07,Finiquitada,1,2007165,039/P-OT-C02-07,ELABORACION DE PROYECTOS PARA EL TRAZO NIVELACION Y CONFORMACION DE TERRACERIAS PARA LOS SIGUIENTES COMITES DE OBRA DEL PROGRAMA DE ESFUERZOS COMPARTIDOS: COMITE Nº. 23 DE LA COL. NUEVO VERGEL COMITE Nº. 281 DE LA COL. MESA COLORADA CRUCERO Y COMITe Nº.,56600,INGENIERIA Y CONSTRUCCIONES ARMUNDO S.A. DE C.V.,Estudio y/o Proyecto,1B,Infraestructura Urbana,Infraestructura Vial,28-May-07,12-Jul-07,Finiquitada,1,2007171,040/P-OT-C02-07,ELABORACION DE PROYECTOS PARA EL TRAZO NIVELACION Y CONFORMACION DE TERRACERIAS PARA LOS SIGUIENTES COMITES DE OBRA DEL PROGRAMA DE ESFUERZOS COMPARTIDOS: COMITE Nº. 137 DE LA COL. HUMEDO DE NEXTIPAC COMITE Nº. 230 DE LA COL. MARCELINO GARCIA BARRAGAN Y,102600,CBC INGENIERIA Y CONSTRUCCION S.A. DE C.V.,Estudio y/o Proyecto,4,Infraestructura Urbana,Infraestructura Vial,4-Jun-07,18-Jul-07,Finiquitada,1,2007266,041/P-OT-C02-07,ELABORACION DE PROYECTOS PARA EL TRAZO NIVELACION Y CONFORMACION DE TERRACERIAS PARA LOS SIGUIENTES COMITES DE OBRA DEL PROGRAMA DE ESFUERZOS COMPARTIDOS: COMITE Nº. 298 DE LA COL. NUEVO MEXICO SUR  Y COMITE Nº. 72 DE LA COL. PARAISOS DEL COLLI,108000,ING. RAMON ESQUEDA AGUAYO,Estudio y/o Proyecto,7,Infraestructura Urbana,Infraestructura Vial,4-Jun-07,18-Jul-07,Finiquitada,1,2007243,045/N-AD-C02-07,SEGUNDA ETAPA PARA LA CONSTRUCCION DE EMPEDRADO UBICADO EN LA CALLE EMILIO PORTES GIL ENTRE LA CALLE JUAREZ Y MIGUEL ALEMAN EN LA COLONIA MIGUEL DE LA MADRID,176686.32,MASSOL CONSTRUCTORA S.A. DE C.V.,Obra,8,Infraestructura Urbana,Infraestructura Vial,14-May-07,14-Jun-07,Finiquitada,1,2007255,046/N-AD-C02-07,SEGUNDA ETAPA CONSTRUCCIoN DE BAniO GARRAPATICIDA UBICADO  A  2 KM DEL NUCLEO EJIDAL EN EL  EJIDO DE NEXTIPAC,246865.05,CONSTRUCTORA IZORCAM S.A. DE C.V.,Obra,RS,Infraestructura Urbana,Infraestructura Rural,14-May-07,14-Jun-07,Finiquitada,1,2007367,048/N-OT-C02-07,REHABILITACION DE SANITARIOS EN LA ESCUELA SECUNDARIA REPUBLICA ITALIANA UBICADA EN LA CALLE 9 NUMERO 180 ENTRE LA AVENIDA ZOQUIPAN Y LAGO CAMECUARO EN LA COLONIA EL SEATLE EN ZAPOPAN JAL.,74936.59,CONSTRUCTIO GERENS S.A. DE C.V.,Obra,1B,Equipamiento Urbano,Educacion,30-Abr-07,21-Jun-07,Finiquitada,1,2007237,050/P-CR-C02-07,CONSTRUCCION DE CARRILES CENTRALES EN LA AV. PROLONGACION MARIANO OTERO DE LOS CADENAMIENTOS 1+570 AL 1+905 Y DEL 2+040 AL 2+261  EN LA COLONIA MARIANO OTERO,5697342.43,TORRES AGUIRRE INGENIEROS S.A. DE C.V.,Obra,7,Infraestructura Urbana,Infraestructura Vial,7-Jul-07,7-Nov-07,Finiquitada,1,200771,051/P-AD-C02-07,ELABORACION DE PROYECTO INTEGRAL PARA EL EDIFICIO CENTRAL DE SEGURIDAD PUBLICA DE ZAPOPAN UBICADO EN PREDIO MUNICIPAL SOBRE LATERAL A PERIFERICO ESQUINA CON CALLE MELCHOR OCAMPO,1088611.29,CONSTRUCTORA DALMA S.A. DE C.V.,Estudio y/o Proyecto,5A,Equipamiento Urbano,Seguridad Publica,13-Jul-07,30-Nov-07,Finiquitada,1,2007221,054/P-OT-C03-07,REPOSICION DE LOSAS DE CONCRETO HIDRAULICO UBICADAS EN LA AVENIDA  TORREMOLINOS ENTRE LAS AVENIDAS DE LA MANCHA Y COVADONGA EN LA COLONIA LOMAS DE ZAPOPAN,100783.9,GALJACK ARQUITECTOS Y CONSTRUCCIONES S.A. DE C.V.,Obra,3,Infraestructura Urbana,Infraestructura Vial,4-Jun-07,3-Jul-07,Finiquitada,1,2007361,055/P-AD-C03-07,CONSTRUCCION DE MURO DE CONTENCION DE MAMPOSTEO EN EL PREDIO DEL PARQUE HUINDIDO UBICADO EN LA CALLE SANTA ESTELA ENTRE LAS CALLES SANTA TERESA Y SANTA ESTHER EN LA COLONIA SANTA MARGARITA,837076.08,SG CONSTRUCTORES S.A. DE C.V.,Obra,1A,Equipamiento Urbano,Areas Verdes,21-May-07,5-Jul-07,Terminada sin Finiquitar,1,2007291,056/N-AD-C03-07,"INSTALACION DE LA RED DE AGUA POTABLE CON TUBERIA DE P.V.C. DE 8"" DE DIAMETRO CLASE RD-26 UBICADA EN LA CALLE EMILIANO ZAPATA ENTRE LAS CALLES DE 7a. PONIENTE Y PASEO DE LOS MIRASOLES EN LA COL. PRADERAS DE SAN ANTONIO",311696.92,CONSTRUCTORA BUENO S.A. DE C.V.,Obra,RS,Infraestructura Urbana,Agua Potable,21-May-07,21-Jun-07,Finiquitada,1,200736,057/N-AD-C03-07,CONSTRUCCION DE EMPEDRADO ZAMPEADO EN LA CALLE SAUCITO ENTRE LA AV. ALCALDE Y LA CALLE FCO. I. MADERO EN LA COL. EL BATAN,340915.43,LIM CONSTRUCTORA S.A. DE C.V.,Obra,1B,Infraestructura Urbana,Infraestructura Vial,21-May-07,26-Jun-07,Finiquitada,1,2007164,059/P-AD-C04-07,CONSTRUCCIoN DE TRANSICIONES LiNEA DE MEDIA TENSIoN SUBTERRANEA Y LiNEA DE ALUMBRADO PuBLICO EN EL KILOMETRO 6+000 UBICACIoN: AVENIDA JUAN GIL PRECIADO CON EL CRUCE DE LA CALLE SAN DIEGO EN LA COLONIA HOGARES DE NVO. MEXICO,561442.12,CONSTRUCCIONES Y ESTRUCTURAS ITZ S.A. DE C.V.,Obra,3,Infraestructura Urbana,Alumbrado Publico,11-Jun-07,11-Jul-07,En proceso,1,2007371,060/P-OT-C04-07,CONSTRUCCIoN DE TECHUMBRE EN EL ESTACIONAMIENTO INTERNO DE LA DIRECCION GENERAL DE OBRAS PUBLICAS UBICADO EN LA AVENIDA LAURELES Nº. 250 EN LA COLONIA TEPEYAC,154243.8,STELLA CONSTRUCCIONES S.A.. DE C.V.,Obra,1B,Equipamiento Urbano,Administracion y Gobierno,21-May-07,21-Jun-07,Finiquitada,1,2007373,061/P-OT-C04-07,ESTUDIO DE MECANICA DE SUELOS A DESARROLLARSE EN EL NUEVO CEMENTERIO DE TESISTAN,10350,ING. EDUARDO ALONSO LOPEZ FLORES,Estudio y/o Proyecto,RS,Equipamiento Urbano,Cementerios,4-Jun-07,19-Jun-07,Finiquitada,1,2007373,062/P-CA-C04-07,CONSTRUCCION DE SEGUNDA ETAPA DEL SUBCENTRO URBANO DE TESISTAN UBICADO SOBRE LA AV. PASEO RIO BLANCO,1375932.61,CONSTRUCTORA SUBURBANA S.A DE C.V,Convenio Adicional,RS,Equipamiento Urbano,Administracion y Gobierno,18-Jun-07,18-Jul-07,Finiquitada,1,200765,063/P-CA-C04-07,SEGUNDA ETAPA PARA LAS OBRAS DE REMODELACION EN LAS OFICINAS DE PADRON Y LICENCIAS UBICADAS EN LA PLANTA BAJA DE PRESIDENCIA MUNICIPAL EN LA CABECERA MUNICIPAL.,82558.55,ING. SERGIO ADRIAN LLAMAS MONREAL,Convenio Adicional,1A,Equipamiento Urbano,Administracion y Gobierno,30-Abr-07,15-May-07,Finiquitada,1,2007296,065/P-AD-C04-07,SUMINISTRO Y COLOCACION DE JUNTAS DE CALZADA TIPO FREYMEX T50 UBICADAS EN EL PASO SUPERIOR DE LA AVENIDA VALLARTA EN SU CRUCE CON LA AVENIDA PATRIA EN LA COLONIA PRADOS VALLARTA,970456.25,OBRAS Y COMERCIALIZACION DE LA CONSTRUCCION S.A. DE C.V.,Obra,5A,Equipamiento Urbano,Equipamiento Vial,18-Jun-07,17-Ago-07,Finiquitada,1,200719,067/P-AD-C04-07,CONSTRUCCION DE LINEA DE ALEJAMIENTO PARA EVITAR INUNDACIONES DE AGUAS PLUVIALES UBICADO EN LA AV. CIRCUNVALACION NORTE ENTRE LAS CALLES PEGASO Y PIRAMIDE DE TEOTIHUACAN EN LA COLONIA ARBOLEDAS,369145.03,JLB CONSTRUCCIONES S.A. DE C.V.,Obra,6,Infraestructura Urbana,Alcantarillado,11-Jun-07,11-Jul-07,Finiquitada,1,2007360,068/P-OT-C04-07,ELABORACION DE PROYECTO PARA EL SUMINISTRO Y COLOCACION DE ALUMBRADO EN EL INTERIOR DE LA SECUNDARIA TECNICA NO. 39 UBICADA EN LA CALLE MORELOS NO. 59 EN LA COLONIA SANTA LUCIA,10819.25,CONSTRUCCIONES Y REMODELACIONES TEPEYAC S.A. DE C.V.,Estudio y/o Proyecto,RS,Equipamiento Urbano,Educacion,11-Jun-07,25-Jun-07,Finiquitada,1,2007164,069/P-OT-C04-07,ELABORACION DE PROYECTO PARA CONSTRUCCION DE CARPETA ASFALTICA Y SELLO SLURRY SEAL SOBRE EMPEDRADO UBICADO EN LA CALLE 6 DE ENERO ENTRE AV. AVIACION Y CALLE ATOTONILCO EN LA  COLONIA HOGARES DE NUEVO MEXICO,11484.63,CONSTRUCCIONES ANAYARI S.A. DE C.V.,Estudio y/o Proyecto,3,Infraestructura Urbana,Infraestructura Vial,11-Jun-07,25-Jun-07,Finiquitada,1,200723,071/N-OT-C04-07,"REHABILITACION DE BEBEDEROS EN LA ESC. ""HERMENEGILDO GALEANA"" LOCALIZADA EN LA CALLE NICOLAS BRAVO #2 DE LA COLONIA ARROYO HONDO 1° SECCION.",30162.26,CONSTRUCTORA OCCIDENTAL DE MÈXICO S.A. DE C.V.,Obra,2A,Equipamiento Urbano,Educacion,11-Jun-07,11-Jul-07,Finiquitada,1,2007360,072/N-CA-C04-07,CONSTRUCCION DE PAVIMENTO DE ADOQUIN EN CALLE MORELOS ENTRE HIDALGO Y MANUEL M. DIEGUEZ EN EL POBLADO DE STA. LUCIA,46299.18,CONSTRUCTORA AGAL S.A. DE C.V.,Convenio Adicional,RS,Infraestructura Urbana,Infraestructura Vial,11-Jun-07,25-Jun-07,Finiquitada,1,2007360,073/N-AD-C04-07,SUMINISTRO Y COLOCACION DE ALUMBRADO EN EL INTERIOR DE LA SECUNDARIA TECNICA NO. 39 UBICADA EN LA CALLE MORELOS NO. 59 EN LA COLONIA SANTA LUCIA,154068.8,ELECON NACIONAL S.A. DE C.V.,Obra,RS,Equipamiento Urbano,Educacion,11-Jun-07,25-Jul-07,Finiquitada,1,2007360,074/P-AD-C05-07,"PROYECTO EJECUTIVO DE UNIDADES DE SERVICIOS MEDICOS DE EMERGENCIAS Y ATENCION MATERNO-INFANTIL"" UBICADO EN LAS CALLES AV. DE LA PRESA PRIVADA DEL RIO RIO BLANCO Y SANTA MoNICA; EN LA COLONIA SANTA LUCIA.",550000,CONSTRUCTORA VICO S.A DE C.V.,Estudio y/o Proyecto,RS,Equipamiento Urbano,Salud,7-Jul-07,30-Nov-07,Finiquitada,1,200765,075/P-AD-C05-07,CONSTRUCCION LLAVE EN MANO DE LA ILUMINACION ARTISTICA DE LA PARROQUIA DE SAN PEDRO APOSTOL UBICADA EN EL CENTRO HISTORICO DE ZAPOPAN.,1150000,CARJAU S.A DE C.V.,Obra,1A,Equipamiento Urbano,Culto,3-Sep-07,24-Dic-07,Terminada sin Finiquitar,1,2007371,076/P-AD-C05-07,ELABORACION DE ANTEPROYECTO ARQUITECTONICO DE LA UNIDAD ZAPOPAN ROMERO UBICADA EN LA COLONIA TEPEYAC CON LOS SIGUIENTES ALCANCES: ESTUDIOS PRELIMINARES PLAN MAESTRO GENERAL Y DESARROLLO DEL ANTEPROYECTO ARQUITECTONICO.,998839.17,ADQUADRUM DESARROLLADORES S.C.,Estudio y/o Proyecto,1B,Equipamiento Urbano,Deportes,16-Ago-07,30-Sep-07,Finiquitada,1,2007370,077/P-AD-C05-07,ELABORACION DE ANTEPROYECTO ARQUITECTONICO DE LA UNIDAD  DEPORTIVA TABACHINES UBICADA EN LA AV. TABACHINES ESQUINA ANILLO PERIFERICO EN LA COLONIA TABACHINES  CON LOS SIGUIENTES ALCANCES: ESTUDIOS PRELIMINARES PLAN MAESTRO GENERAL Y DESARROLLO DEL ANTEPR,717513.75,AVANTE ARQUITECTOS Y ASOCIADOS S.A. DE C.V.,Estudio y/o Proyecto,2A,Equipamiento Urbano,Deportes,29-May-07,13-Jul-07,Finiquitada,1,2007237,078/P-AD-C05-07,ELABORACION DE PROYECTO PARA LA CONSTRUCCION DE PARQUE LINEAL SOBRE EL ARROYO GRANDE DE LOS CADENAMIENTOS 0+260 AL 1+000 Y DEL 1+000 AL 1+320,276000,DOLMEN TALLER DE ARQUITECTURA S.A. DE C.V.,Estudio y/o Proyecto,7,Equipamiento Urbano,Recreacion y Esparcimiento,18-Jun-07,17-Ago-07,Finiquitada,1,2007408,079/P-AD-C05-07,ESTUDIO DE DIAGNOSTICO DE SERVICIOS URBANOS EN LA COLONIA VILLA DE GUADALUPE,238836.6,GALJACK ARQUITECTOS Y CONSTRUCCIONES S.A. DE C.V.,Estudio y/o Proyecto,2B,Infraestructura Urbana,Otros,29-May-07,28-Jun-07,Finiquitada,1,2007240,080/P-OT-C05-07,ESTUDIO DEL DIAGNOSTICO DE SERVICIOS URBANOS EN LA COLONIA MESA COLORADA PONIENTE,132664.575,ING. IVAN JAIME DE ALBA PADILLA,Estudio y/o Proyecto,2B,Infraestructura Urbana,Otros,29-May-07,28-Jun-07,Finiquitada,1,2007241,083/P-OT-C05-07,ESTUDIO DEL DIAGNOSTICO DE SERVICIOS URBANOS EN LA COLONIA MESA DE LOS OCOTES,161128.8,INECO CONSTRUYE S.A. DE C.V.,Estudio y/o Proyecto,2B,Infraestructura Urbana,Otros,29-May-07,28-Jun-07,Finiquitada,1,20077,084/P-OT-C05-07,ELABORACION DE PROYECTO PARA LA PAVIMENTACIoN CON CONCRETO HIDRAULICO UBICADO EN LAS CALLES : VICENTE GUERRERO Y LAZARO CARDENAS ENTRE LOPEZ MATEOS Y FRANCISCO VILLA  FRANCISCO VILLA ENTRE LAZARO CARDENAS Y JOSEFA ORTIZ DE DOMiNGUEZ JOSEFA ORTIZ DE DOMi,153310.5844,GRUPO DE INGENIERIA PARA ESTUDIOS Y CONTROL DE CALIDAD S.A. DE C.V.,Estudio y/o Proyecto,8,Infraestructura Urbana,Infraestructura Vial,25-Jun-07,08-Ago-07,Finiquitada,1,2007274,090/P-OT-C05-07,ELABORACION DE PROYECTO EJECUTIVO PARA LA CONSTRUCCION DE PUENTE VEHICULAR Y PEATONAL UBICADO EN CALLE PASEO DE LA FAMILIA Y ARROYO EL GARABATO PARALELO A CALLE SANTA EDUWIGES EN LA COLONIA PASEOS DEL BRISEniO.,73625,ING. OSCAR MARTIN RODRIGUEZ PALOS,Estudio y/o Proyecto,8,Equipamiento Urbano,Equipamiento Vial,2-Jul-07,30-Ago-07,Finiquitada,1,2007203,092/P-OT-C05-07,ELABORACION DE PROYECTO PARA LA CONSTRUCCION DE REDES DE ALCANTARILLADO AGUA POTABLE Y PAVIMENTO DE CONCRETO HIDRAULICO UBICADO EN LA CALLE SOLERAS ENTRE LA AVENIDA INGLATERRA Y AVENIDA VALLARTA EN LA COLONIA JOCOTAN,88027.631,CONSTRUCTORA LOISOR S.A. DE C.V.,Estudio y/o Proyecto,5A,Infraestructura Urbana,Infraestructura Vial,4-Jun-07,3-Jul-07,Finiquitada,1,2007399,095/P-OT-C05-07,PROYECTO DE ADECUACION POR REUBICACION DE LA PLANTA DE TRANSFERENCIA DE RESIDUOS SOLIDOS UBICADA EN LOS CRUCES DE LATERAL DEL ANILLO PERIFERICO Y LA CALLE MELCHOR OCAMPO EN LA COLONIA EL VIGIA,241500,KENZO CONCRETO ARMADO S.A DE C.V,Estudio y/o Proyecto,1B,Equipamiento Urbano,Ecologia,31-Jul-07,29-Sep-07,Finiquitada,1,200711,096/P-OT-C05-07,ELABORACION DE PROYECTO EJECUTIVO PARA LA ADECUACION VIAL CONSISTENTE EN REHABILITACION DE CARPETA ASFALTICA Y CONSTRUCCION DE ISLETAS Y CAMELLONES EN EL CRUCERO DE LA AVENIDA SIERRA DE TAPALPA Y AVENIDA DEL TESORO EN LA COLONIA LAS AGUILAS,40738.54167,CONSTRUCCION Y MATERIALES DE JALISCO. S.A. DE C.V.,Estudio y/o Proyecto,6,Equipamiento Urbano,Equipamiento Vial,18-Jun-07,01-Ago-07,Finiquitada,1,2007255,101/P-OT-C05-07,ELABORACIoN DE PROYECTO PARA LA CONSTRUCCIoN DE CAMINOS RURALES UBICADOS  EN LA MOJONERA A NEXTIPAC CAMINO A LA PEniITA CAMINO DE LA PEniA A LA LAGUNA CAMINO A LAS PALOMAS CAMINO AL BAJIO Y CAMINO AL BRAMIDO EN EL EJIDO NEXTIPAC,83333.33333,PROYECTOS Y SEGUIMIENTO TECNICO DE OBRAS S.A. DE C.V.,Estudio y/o Proyecto,RS,Infraestructura Urbana,Infraestructura Rural,22-Sep-07,22-Oct-07,Finiquitada,1,2007396,110/P-OT-C05-07,REHABILITACION DE ALCANTARILLADO SANITARIO CONSTRUCCION DE POZOS DE VISITA RELLENO MEJORADO CON CEMENTO RETENIDAS CON MAMPOSTERIA Y ZAMPEADO CON PIEDRA BRAZA LOCALIZADA EN LA CALLE PINO ENTRE LAS CALLES GIGANTE Y TABACHINES EN LA COLONIA VICENTE GUERR,205708.03,CONSTRUCTORA CEICO S.A. DE C.V.,Obra,3,Infraestructura Urbana,Alcantarillado,4-Jun-07,18-Jul-07,Finiquitada,1,2007110,112/P-OT-C05-07,ELABORACION DE PROYECTO PARA LA PAVIMENTO DE EMPEDRADO  EN EL CAMINO SACACOSECHAS UBICADO EN EL CADENAMIENTO 0+000 AL 0+500 ENTRE EL POTRERO CHAMOLUCO Y EL POTRERO DE LOS CHAVEZ EN EL EJIDO DE COPALA.,9000,CONSTRUCTORA IZORCAM S.A. DE C.V.,Estudio y/o Proyecto,RN,Infraestructura Urbana,Infraestructura Rural,18-Jun-07,2-Jul-07,Finiquitada,1,2007282,116/P-OT-C05-07,"ELABORACION DE PROYECTO PARA CONSTRUCCION DE LA RED DE AGUA POTABLE DE 4"" CON TUBERIA DE PVC RD-26 EN LA LATERAL DE CARRETERA A SALTILLO ENTRE DIAMANTE Y OPALO CORAL ENTRE ARROYO Y CERRADA AL ORIENTE CANTERA ENTRE ARROYO Y CORAL Y OBSIDIANA ENTRE OPALO",10832.42,GRUPO LAADE S.C.,Estudio y/o Proyecto,2B,Infraestructura Urbana,Agua Potable,2-Jul-07,16-Jul-07,Finiquitada,1,2007164,117/P-CA-C05-07,PAVIMENTO DE EMPEDRADO EN LA CALLE SAN JUAN DE LOS LAGOS ENTRE LAS CALLES 12 DE OCTUBRE Y 1o DE NOVIEMBRE BOCA DE TORMENTA EN LA CALLE SAN JUAN DE LOS LAGOS Y  LINEA DE ALEJAMIENTO Y CAJA DE SALIDA EN LA CALLE SAN JUAN DE LOS LAGOS Y 12 DE OCTUBRE EN LA,42933.37,ARQ. JOSE EDUARDO ZENDEJAS GAITAN,Convenio Adicional,3,Infraestructura Urbana,Infraestructura Vial,30-Jul-07,13-Ago-07,Finiquitada,1,2007266,122/P-AD-C05-07,TRAZO NIVELACION Y CONFORMACION DE TERRACERIAS PARA EMPEDRADO EN LA CALLE TABACHIN DESDE GALEANA HASTA PROLONGACION TEPEYAC EN LA COLONIA PARAISOS DEL COLLI COMITe 72,273389.68,DESARROLLOS INMOBILIARIOS NUEVO MILENIO S.A. DE C.V.,Obra,7,Infraestructura Urbana,Infraestructura Vial,18-Jun-07,02-Ago-07,Finiquitada,1,2007266,123/P-OT-C05-07,TRAZO NIVELACION Y CONFORMACION DE TERRACERIA EN LA CALLE MALVASTE DE PROL. TEPEYAC HASTA CHABACANO EN LA COLONIA PARAISOS DEL COLLI DEL COMITE NO. 157,195224.45,SAHUAYALA S.A. DE C.V.,Obra,7,Infraestructura Urbana,Infraestructura Vial,18-Jun-07,02-Ago-07,Finiquitada,1,2007266,124/P-OT-C05-07,TRAZO NIVELACION Y CONFORMACION DE TERRACERIA EN LA CALLE MEZQUITE DE CHABACANO A SIDRA EN LA COLONIA PARAISOS DEL COLLI DEL COMITE NO. 345,102304.3,GRANDE DE MEXICO CONSTRUCTORA E INMOBILIARIA S.A. DE C.V.,Obra,7,Infraestructura Urbana,Infraestructura Vial,12-Jul-07,12-Ago-07,Finiquitada,1,2007236,125/P-AD-C05-07,TRAZO NIVELACION Y CONFORMACION DE TERRACERIAS EN: CALLE ANDADOR 1 ENTRE CALLE GUAYABOS A PRIVADA 1 Y PRIVADA 1 DE ANDADOR 1 HASTA EL MURO DE CONTENCION EN LA COLONIA MARCELINO GARCIA BARRAGAN COMITE 230.,542833.03,PROYECTOS CONSTRUCTIVOS PAIS S.A DE C.V.,Obra,3,Infraestructura Urbana,Infraestructura Vial,25-Jun-07,5-Sep-07,Terminada sin Finiquitar,1,2007222,126/P-OT-C05-07,TRAZO NIVELACION Y CONFORMACION DE TERRACERIA EN LA PRIV. FRANCISCO VILLA DE MORELOS A JOSEFA ORTIZ DE DOMINGUEZ EN LA COLONIA LOMAS DEL BATAN DEL COMITE NO. 34A,181731.66,GRANDE DE MEXICO CONSTRUCTORA E INMOBILIARIA S.A. DE C.V.,Obra,1B,Infraestructura Urbana,Infraestructura Vial,12-Jul-07,25-Ago-07,Finiquitada,1,2007237,134/P-AD-C06-07,RENIVELACION DE EMPEDRADO Y PAVIMENTACION CON MEZCLA ASFALTICA SOBRE LATERAL NORTE DE LA AVENIDA PROLONGACION MARIANO OTERO ENTRE EL ANILLO PERIFERICO Y AVENIDA TEPEYAC.,616561.3,GRUPO CONSTRUCTOR PERSEVERANCIA S.A. DE C.V.,Obra,7,Infraestructura Urbana,Infraestructura Vial,11-Jun-07,10-Jul-07,Finiquitada,1,2007408,135/P-OT-C06-07,PAVIMENTACION DE LA CALLE CASIANO TORRES ENTRE CARRETERA A SALTILLO Y CALLE JUAN JOSE GRCIA CALLE JUAN JOSE GARCIA ENTRE LA CALLE CASIANO TORRES Y CALLE IGNACIO ESPINOZA COLONIA VILLA DE GUADALUPE,159365.93,SENA PROYECTOS ESTRUCTURALES Y DE CONSTRUCCIoN S.A. DE C.V.,Obra,2B,Infraestructura Urbana,Infraestructura Vial,11-Jun-07,17-Jun-07,Finiquitada,1,2007361,136/P-AD-C06-07,PAVIMENTO ASFALTICO SOBRE LA CALLE PRIVADA SANTA LAURA FRENTE AL CENTRO METROPOLITANO DEL ADULTO MAYOR EN LA COLONIA SANTA MARGARITA.,383405.68,CONSTRUCCIONES CITUS S.A. DE C.V.,Obra,1A,Infraestructura Urbana,Infraestructura Vial,11-Jun-07,10-Jul-07,Finiquitada,1,20077,138/P-OT-C06-07,CANAL A CIELO ABIERTO Y ALIVIO DEL CANAL AGUA PRIETA EN SU CRUCE CON LA AV. LAS TORRES EN LA COLONIA AGUA BLANCA HASTA EL LIMITE CON TLAQUEPAQUE.,223006.62,TEPULI S.A. DE C.V.,Obra,8,Infraestructura Urbana,Colectores,4-Jun-07,1-Jul-07,Finiquitada,1,2007250,139/P-AD-C06-07,SEGUNDA ETAPA PARA LA CONSTRUCCION DE MUROS DE MAMPOSTERIA CON PIEDRA BRAZA Y BARDEO EN AMBAS MARGENES DEL ARROYO SECO ENTRE PUERTO LOS SANTOS Y AV. TEPEYAC EN LA COLONIA MIRAMAR.,405460.86,MORPHEUZ CONSTRUCCION ILIMITADA S.A DE C.V.,Obra,7,Infraestructura Urbana,Colectores,9-Jul-07,22-Jul-07,Finiquitada,1,2007356,140/N-AD-C06-07,CONSTRUCCION DE PASO PEATONAL Y ZAMPEADO DE EMPEDRADO EN LA CALLE ALLENDE Y PASEO DE LA CAniADA EN LA COLONIA SANTA ANA TEPETITLAN,385898.83,NAPRECO GRUPO CONSTRUCTOR S.A. DE C.V.,Obra,8,Infraestructura Urbana,Infraestructura Vial,14-Jul-07,14-Sep-07,Finiquitada,1,2007237,141/P-AD-C06-07,CONSTRUCCION DE MURO DE MAMPOSTERIA EN AMBAS MARGENES DEL ARROYO GARABATOS (PRIVADA DE LAS FLORES) ENTRE LAS CALLES AZAHARES Y LA CONFLUENCIA DE LAS CALLES ZAFIRO Y LAS FLORES EN LA COLONIA MARIANO OTERO.,847725.72,INFRAESTRUCTURA SAN MIGUEL S.A. DE C.V.,Obra,7,Infraestructura Urbana,Colectores,11-Jun-07,22-Jul-07,Finiquitada,1,2007122,144/P-OT-C06-07,CONSTRUCCION DE EMPEDRADO CON HUELLAS DE ADOQUIN EN EL CRUCE DE LA CALLE AGUSTIN LARA Y AV. TCHAIKOVSKY EN LA COLONIA LA ESTANCIA.,177321.49,CONSTRUCTORA VIRVAN S.A. DE C.V.,Obra,5A,Infraestructura Urbana,Infraestructura Vial,5-Jul-07,02-Ago-07,Finiquitada,1,2007